title,description,content,category,text
Meta Tapped a Pentagon Supplier to Prototype Face Recognition for Its Glasses,"Rank One, whose board includes a former CIA deputy director and a former FBI science chief, supplied face recognition to Meta for internal development of its smart glasses app.","Meta is testingface-recognition software built by a company that sells surveillance tools to police departments and the United States military, as it explores bringing the technology to its smart gla… [+3367 chars]",science,meta tapped a pentagon supplier to prototype face recognition for its glasses rank one whose board includes a former cia deputy director and a former fbi science chief supplied face recognition to meta for internal development of its smart glasses app meta is testingfacerecognition software built by a company that sells surveillance tools to police departments and the united states military as it explores bringing the technology to its smart gla chars
"Taller, faster, older: How top footballers' bodies have changed over 50 years","More intense match play and advances in medicine and sports science have transformed the physiology of elite players, experts say.","Studies suggest that in the 1970s, players walked, jogged or ran an average of 8.7km per match - and this rose to a peak of 11.4km in the 1990s, but has since dropped. Players in the 2022 World Cup c… [+111 chars]",science,taller faster older how top footballers bodies have changed over years more intense match play and advances in medicine and sports science have transformed the physiology of elite players experts say studies suggest that in the s players walked jogged or ran an average of km per match and this rose to a peak of km in the s but has since dropped players in the world cup c chars
"Scientists Pulled 700,000-Year-Old DNA From Frozen Squirrel Poop","Ancient poop left behind by Arctic ground squirrels ended up containing a remarkable array of genetic information, a study says.","Arctic ground squirrels will eat just about anything. Apparently, they have been like this for at least 700,000 yearsas evidenced by their poop, preserved in Yukons deep permafrost. But thats not all… [+3123 chars]",science,scientists pulled yearold dna from frozen squirrel poop ancient poop left behind by arctic ground squirrels ended up containing a remarkable array of genetic information a study says arctic ground squirrels will eat just about anything apparently they have been like this for at least yearsas evidenced by their poop preserved in yukons deep permafrost but thats not all chars
Taylor Swift Confirms Original Song for ‘Toy Story 5’,"Plus, new looks at Tombstone, Bullseye, Luke Cage, and Iron Fist!",Killer wasps from Twilight Zone Magazine to receive film treatment from Pulitzer-winning novelist. Mystery Science Theater 3000 previews its new opening title sequence. SXSW London to celebrate Latve… [+2991 chars],science,taylor swift confirms original song for toy story plus new looks at tombstone bullseye luke cage and iron fist killer wasps from twilight zone magazine to receive film treatment from pulitzerwinning novelist mystery science theater previews its new opening title sequence sxsw london to celebrate latve chars
I took a sweat test at Gatorade's elite sports lab. It revealed 3 hydration mistakes I was making.,"A sweat test at Gatorade's sports science lab for elite athletes revealed I wasn't consuming enough water, electrolytes, or carbs during workouts.","The Gatorade Sports Science Institute offers exercise testing for elite athletes. I put my sweat to the test as an amateur roller derby athlete.Clark Hodgin for BI
""It's HOW hot in here?""I'm no stra… [+9858 chars]",science,i took a sweat test at gatorades elite sports lab it revealed hydration mistakes i was making a sweat test at gatorades sports science lab for elite athletes revealed i wasnt consuming enough water electrolytes or carbs during workouts the gatorade sports science institute offers exercise testing for elite athletes i put my sweat to the test as an amateur roller derby athleteclark hodgin for bi its how hot in hereim no stra chars
The first-ever reverse-aging drug was just injected into a human,"Cellular reprogramming is the hottest topic in longevity science, with tech titans like Sam Altman investing in it. It's now being tested in humans.","The first-ever reverse-aging drug has been injected into a human.Catherine Falls Commercial/Getty Images
<ul><li>In a breakthrough for longevity science, a reverse-aging treatment has been injected … [+7424 chars]",science,the firstever reverseaging drug was just injected into a human cellular reprogramming is the hottest topic in longevity science with tech titans like sam altman investing in it its now being tested in humans the firstever reverseaging drug has been injected into a humancatherine falls commercialgetty images ulliin a breakthrough for longevity science a reverseaging treatment has been injected chars
Claude Science,"Claude Science is your AI workbench for scientific research. Works through your research like a skilled scientist, running the analysis and tracing every step. Spend less time stitching pipelines together, and more time on the science.","<li>Help me develop a unique voice for an audience
Hi Claude! Could you help me develop a unique voice for an audience? If you need more information from me, ask me 1-2 key questions right away. If … [+1962 chars]",science,claude science claude science is your ai workbench for scientific research works through your research like a skilled scientist running the analysis and tracing every step spend less time stitching pipelines together and more time on the science lihelp me develop a unique voice for an audience hi claude could you help me develop a unique voice for an audience if you need more information from me ask me key questions right away if chars
Should We Be Worried About the Artificial Dyes in our Food?,"Robert F. Kennedy Jr. has argued that artificial dyes are ""poisonous compounds"" that are harming America's kids. Does he actually have a point?","Growing up, few things in the supermarket excited me as much as a colorful bag of candy, a breakfast cereal box, or another sugary snack. And even today, though I try to keep my sweet tooth in check,… [+15881 chars]",science,should we be worried about the artificial dyes in our food robert f kennedy jr has argued that artificial dyes are poisonous compounds that are harming americas kids does he actually have a point growing up few things in the supermarket excited me as much as a colorful bag of candy a breakfast cereal box or another sugary snack and even today though i try to keep my sweet tooth in check chars
Feds Charge 2 NIH Scientists With ‘Conspiracy to Smuggle’ Deadly Virus,Researchers with NIH’s Rocky Mountain Laboratories in Montana reentered the country with inactivated mpox. But was that a crime?,Two government scientists with the U.S. National Institutes of Healths Rocky Mountain Laboratories reentered the country this January with a large black plastic case that worried customs officials. F… [+4253 chars],science,feds charge nih scientists with conspiracy to smuggle deadly virus researchers with nihs rocky mountain laboratories in montana reentered the country with inactivated mpox but was that a crime two government scientists with the us national institutes of healths rocky mountain laboratories reentered the country this january with a large black plastic case that worried customs officials f chars
The college with the highest-earning graduates in every US state,"These colleges and universities produced the highest-earning graduates in their states, according to median earnings. See the full list.","At some schools, investing in higher education pays off more than in others.
Business Insider recently identified the 34 US colleges with the highest-paid graduates four years after completing their… [+14256 chars]",science,the college with the highestearning graduates in every us state these colleges and universities produced the highestearning graduates in their states according to median earnings see the full list at some schools investing in higher education pays off more than in others business insider recently identified the us colleges with the highestpaid graduates four years after completing their chars
"Robot tadpole fools frog dads, but mom knows better","A researcher studying how amphibious creatures communicate was able to trick frog dads, but the moms were not fooled. 
When Billie Goolsby, who is hard of hearing, told her chemistry professor at Boston University that she wanted to pursue science, she was to…","A researcher studying how amphibious creatures communicate was able to trick frog dads, but the moms were not fooled. 
When Billie Goolsby, who is hard of hearing, told her chemistry professor at Bo… [+1261 chars]",science,robot tadpole fools frog dads but mom knows better a researcher studying how amphibious creatures communicate was able to trick frog dads but the moms were not fooled when billie goolsby who is hard of hearing told her chemistry professor at boston university that she wanted to pursue science she was to a researcher studying how amphibious creatures communicate was able to trick frog dads but the moms were not fooled when billie goolsby who is hard of hearing told her chemistry professor at bo chars
BBC Inside Science,How do you research the impacts of social media on young people?,"Available for 34 days
After this weeks announcement that under-16s will be banned from major social media platforms, we delve into the evidence behind the ban with Professor Amy Orben, Programme Lea… [+648 chars]",science,bbc inside science how do you research the impacts of social media on young people available for days after this weeks announcement that unders will be banned from major social media platforms we delve into the evidence behind the ban with professor amy orben programme lea chars
The science around GLP-1 drugs and cancer is suddenly getting a lot more interesting,The story of GLP-1 drugs keeps getting bigger. First they transformed the treatment of diabetes. Then they upended the science - and culture - of weight loss...,"The story of GLP-1 drugs keeps getting bigger.
First they transformed the treatment of diabetes. Then they upended the science - and culture - of weight loss. Now a growing body of research is raisi… [+10009 chars]",science,the science around glp drugs and cancer is suddenly getting a lot more interesting the story of glp drugs keeps getting bigger first they transformed the treatment of diabetes then they upended the science and culture of weight loss the story of glp drugs keeps getting bigger first they transformed the treatment of diabetes then they upended the science and culture of weight loss now a growing body of research is raisi chars
"No more lightbulbs, much more sports: Five predictions for Roku’s future","This is Lowpass by Janko Roettgers, a newsletter on the ever-evolving intersection of tech and entertainment, syndicated just for The Verge subscribers once a week. When Fox announced its acquisition of Roku earlier this week, executives of both companies wer…","<ul><li></li><li></li><li></li></ul>
How getting acquired by Fox will change things for the streaming device maker, from its IoT business to its international expansion.
How getting acquired by Fox… [+7892 chars]",entertainment,no more lightbulbs much more sports five predictions for rokus future this is lowpass by janko roettgers a newsletter on the everevolving intersection of tech and entertainment syndicated just for the verge subscribers once a week when fox announced its acquisition of roku earlier this week executives of both companies wer ullilililililiul how getting acquired by fox will change things for the streaming device maker from its iot business to its international expansion how getting acquired by fox chars
"Bob Iger’s Disney wanted Apple, Twitter, and 007","Bob Iger's tenure as CEO of Disney came to an end a few months ago, after two decades of leading the entertainment giant through some of its most pivotal transformations and acquisitions. Iger, in an exit interview with The Financial Times, has now confirmed …","<ul><li></li><li></li><li></li></ul>
An exit interview with the former Disney CEO confirms the massive deals that got away.
An exit interview with the former Disney CEO confirms the massive deals t… [+3848 chars]",entertainment,bob igers disney wanted apple twitter and bob igers tenure as ceo of disney came to an end a few months ago after two decades of leading the entertainment giant through some of its most pivotal transformations and acquisitions iger in an exit interview with the financial times has now confirmed ullilililililiul an exit interview with the former disney ceo confirms the massive deals that got away an exit interview with the former disney ceo confirms the massive deals t chars
Is Apple TV the new HBO?,"This is Lowpass by Janko Roettgers, a newsletter on the ever-evolving intersection of tech and entertainment, syndicated just for The Verge subscribers once a week. Severance. Pachinko. Silo. Ted Lasso. Over the past couple of years, a number of Apple TV show…","<ul><li></li><li></li><li></li></ul>
Unlike competitors like Netflix, Apple TV emphasizes tentpole titles over large catalogs.
Unlike competitors like Netflix, Apple TV emphasizes tentpole titles o… [+6523 chars]",entertainment,is apple tv the new hbo this is lowpass by janko roettgers a newsletter on the everevolving intersection of tech and entertainment syndicated just for the verge subscribers once a week severance pachinko silo ted lasso over the past couple of years a number of apple tv show ullilililililiul unlike competitors like netflix apple tv emphasizes tentpole titles over large catalogs unlike competitors like netflix apple tv emphasizes tentpole titles o chars
God of War Laufey is coming to the PS5,"Sony ended its big State of Play showcase with a major reveal: the next God of War. The new title is called God of War Laufey, and is once again developed by Sony's Santa Monica studio. Currently, the game doesn't have a date, but it's coming to the PS5 whene…","<ul><li></li><li></li></ul>
Dad games are so over.
by
Andrew WebsterClose
Senior entertainment editor
Posts from this author will be added to your daily email digest and your homepage feed.
Fol… [+2057 chars]",entertainment,god of war laufey is coming to the ps sony ended its big state of play showcase with a major reveal the next god of war the new title is called god of war laufey and is once again developed by sonys santa monica studio currently the game doesnt have a date but its coming to the ps whene ullilililiul dad games are so over by andrew websterclose senior entertainment editor posts from this author will be added to your daily email digest and your homepage feed fol chars
Square Enix announces Kingdom Hearts 4,"A different kind of Sora is back in the news. Square Enix just teased the long-awaited next entry in the Kingdom Hearts series, though there's not much in the way of info just yet. It's called Kingdom Hearts IV and it's launching on the Switch 2, PS5, Xbox, a…","<ul><li></li><li></li><li></li></ul>
No word on a release date yet.
No word on a release date yet.
by
Andrew WebsterClose
Senior entertainment editor
Posts from this author will be added to you… [+1850 chars]",entertainment,square enix announces kingdom hearts a different kind of sora is back in the news square enix just teased the longawaited next entry in the kingdom hearts series though theres not much in the way of info just yet its called kingdom hearts iv and its launching on the switch ps xbox a ullilililililiul no word on a release date yet no word on a release date yet by andrew websterclose senior entertainment editor posts from this author will be added to you chars
Nintendo’s next Direct showcase is on June 9th,"Summer Game Fest may be over, but the flood of gaming news isn't. Nintendo just announced that it'll be holding its next Direct showcase event on June 9th at 10AM ET. The stream, which you can find here, will be followed by a Treehouse Live event, and it soun…","<ul><li></li><li></li><li></li></ul>
Well likely finally hear more about the Switch 2s holiday lineup.
Well likely finally hear more about the Switch 2s holiday lineup.
by
Andrew WebsterClose
Se… [+2391 chars]",entertainment,nintendos next direct showcase is on june th summer game fest may be over but the flood of gaming news isnt nintendo just announced that itll be holding its next direct showcase event on june th at am et the stream which you can find here will be followed by a treehouse live event and it soun ullilililililiul well likely finally hear more about the switch s holiday lineup well likely finally hear more about the switch s holiday lineup by andrew websterclose se chars
Gears of War: E-Day is no longer coming to the PS5,"Apparently, the ""return of Xbox"" means a retreat from other platforms. At its Xbox Games Showcase today, Microsoft revealed that Gears of War: E-Day - which was previously rumored for a PS5 launch in addition to Xbox and PC - will not be coming to PlayStation…","<ul><li></li><li></li><li></li></ul>
The Xbox console exclusive is launching in October.
The Xbox console exclusive is launching in October.
by
Andrew WebsterClose
Senior entertainment editor
P… [+2250 chars]",entertainment,gears of war eday is no longer coming to the ps apparently the return of xbox means a retreat from other platforms at its xbox games showcase today microsoft revealed that gears of war eday which was previously rumored for a ps launch in addition to xbox and pc will not be coming to playstation ullilililililiul the xbox console exclusive is launching in october the xbox console exclusive is launching in october by andrew websterclose senior entertainment editor p chars
Tommy Fury against strongman Hall is boxing's latest surreal bout,"Saturday's fight between Tommy Fury v Eddie Hall in Manchester will be an exhibition contest in what is boxing's latest surreal bout, blurring the lines between professional sport, entertainment and social media celebrity.","The world of influencer boxing takes another surreal turn on Saturday when former World's Strongest Man Eddie Hall faces reality television star and professional boxer Tommy Fury in Manchester.
The … [+1467 chars]",entertainment,tommy fury against strongman hall is boxings latest surreal bout saturdays fight between tommy fury v eddie hall in manchester will be an exhibition contest in what is boxings latest surreal bout blurring the lines between professional sport entertainment and social media celebrity the world of influencer boxing takes another surreal turn on saturday when former worlds strongest man eddie hall faces reality television star and professional boxer tommy fury in manchester the chars
Graphics Upgrade for Nintendo Entertainment System,"Modern video game consoles rarely have expansion ports, but in the 80s and 90s it was practically guaranteed. With the speed that hardware was advancing it made sense to build in some way to expand…","Modern video game consoles rarely have expansion ports, but in the 80s and 90s it was practically guaranteed. With the speed that hardware was advancing it made sense to build in some way to expand a… [+1484 chars]",entertainment,graphics upgrade for nintendo entertainment system modern video game consoles rarely have expansion ports but in the s and s it was practically guaranteed with the speed that hardware was advancing it made sense to build in some way to expand modern video game consoles rarely have expansion ports but in the s and s it was practically guaranteed with the speed that hardware was advancing it made sense to build in some way to expand a chars
Xbox and PlayStation have a lot to prove,"Things are bad out there. Despite 2026 shaping up to be a great year when it comes to actual games, it couldn't really be worse for the people that make them or the industry as a whole. Hardware prices keep going up, layoffs have shown no signs of stopping, a…","<ul><li></li><li></li><li></li></ul>
Xbox and PlayStation have a lot to prove
The game industry is in turmoil, but Summer Game Fest could be a place for the big console makers to show strength.
by… [+7172 chars]",entertainment,xbox and playstation have a lot to prove things are bad out there despite shaping up to be a great year when it comes to actual games it couldnt really be worse for the people that make them or the industry as a whole hardware prices keep going up layoffs have shown no signs of stopping a ullilililililiul xbox and playstation have a lot to prove the game industry is in turmoil but summer game fest could be a place for the big console makers to show strength by chars
How to end a TV show,"Ending any story is hard, but that's especially true of mystery-packed TV shows. Series like Lost initially hook viewers with constantly building secrets and questions, to the point that they can often seem incomprehensible. But the promise is that it will al…","<ul><li></li><li></li><li></li></ul>
How to end a TV show
The creative minds behind From talk about learning from Lost, fan expectations, and wrapping up a story loaded with mysteries.
by
Andrew … [+6947 chars]",entertainment,how to end a tv show ending any story is hard but thats especially true of mysterypacked tv shows series like lost initially hook viewers with constantly building secrets and questions to the point that they can often seem incomprehensible but the promise is that it will al ullilililililiul how to end a tv show the creative minds behind from talk about learning from lost fan expectations and wrapping up a story loaded with mysteries by andrew chars
Bose is becoming a media company,"Bose is launching a new entertainment division, Bose Studios, which includes the creation of a record label.","Grammy-nominated Twitch streamer PlaqueBoyMax, recording a live stream with Bose. The audio-equipment company is pushing further into entertainment with podcasts, TV and film series, and a record lab… [+4085 chars]",entertainment,bose is becoming a media company bose is launching a new entertainment division bose studios which includes the creation of a record label grammynominated twitch streamer plaqueboymax recording a live stream with bose the audioequipment company is pushing further into entertainment with podcasts tv and film series and a record lab chars
"Who is David Sullivan - football boss, 'king of porn' and alleged sexual predator?","The ex-West Ham boss has long boasted of sexual conquests, but is now accused of exploitative behaviour.","One of the paper's reporters, Tina Dalgleish, responded to an advert for ""promotional entertainment work"". She reported that Sullivan told her she would have to have sex as part of the job and that h… [+168 chars]",entertainment,who is david sullivan football boss king of porn and alleged sexual predator the exwest ham boss has long boasted of sexual conquests but is now accused of exploitative behaviour one of the papers reporters tina dalgleish responded to an advert for promotional entertainment work she reported that sullivan told her she would have to have sex as part of the job and that h chars
Grand Theft Auto VI is warping the video game release calendar,"Who's afraid of the next GTA? Based on the last few days of Summer Game Fest, just about everyone. Grand Theft Auto VI hasn't been present at any of the keynote events, but its presence was felt every time a release date was announced. The month of November, …","<ul><li></li><li></li><li></li></ul>
The months ahead of GTAs November launch are becoming increasingly crowded.
The months ahead of GTAs November launch are becoming increasingly crowded.
by
And… [+5424 chars]",entertainment,grand theft auto vi is warping the video game release calendar whos afraid of the next gta based on the last few days of summer game fest just about everyone grand theft auto vi hasnt been present at any of the keynote events but its presence was felt every time a release date was announced the month of november ullilililililiul the months ahead of gtas november launch are becoming increasingly crowded the months ahead of gtas november launch are becoming increasingly crowded by and chars
The 7 biggest storylines from Summer Game Fest 2026,"The 2026 edition of Summer Game Fest just wrapped up, and it was surprisingly hectic. The nearly week-long event came at a challenging time for the games industry, and for the most part the big keynotes were used as a chance to show some strength through majo…","<ul><li></li><li></li><li></li></ul>
PlayStation and Xbox are going old-school, and GTA VI was everywhere and nowhere at the same time.
PlayStation and Xbox are going old-school, and GTA VI was eve… [+4105 chars]",entertainment,the biggest storylines from summer game fest the edition of summer game fest just wrapped up and it was surprisingly hectic the nearly weeklong event came at a challenging time for the games industry and for the most part the big keynotes were used as a chance to show some strength through majo ullilililililiul playstation and xbox are going oldschool and gta vi was everywhere and nowhere at the same time playstation and xbox are going oldschool and gta vi was eve chars
