title,description,content,category,text
Firefox’s new home page widgets are helping me focus,"I launched Firefox this morning to find some new blocks on my home page. The widgets that are currently rolling out add sports scores, time zones, a focus timer, and a checklist, which are already some of my favorite new Firefox features in years. I usually h…","<ul><li></li><li></li><li></li></ul>
The browsers new tabs can have a built-in checklist and customizable focus timer.
The browsers new tabs can have a built-in checklist and customizable focus tim… [+2282 chars]",sports,firefoxs new home page widgets are helping me focus i launched firefox this morning to find some new blocks on my home page the widgets that are currently rolling out add sports scores time zones a focus timer and a checklist which are already some of my favorite new firefox features in years i usually h ullilililililiul the browsers new tabs can have a builtin checklist and customizable focus timer the browsers new tabs can have a builtin checklist and customizable focus tim chars
Facebook’s new AI Mode search gets its info from public posts,"Your public Facebook posts could help inform AI-generated results in Meta's new AI Mode. When you search on Facebook, the ""AI Mode"" option will appear alongside the usual search modes like ""People"" and ""Marketplace."" It's one of several new AI features Meta i…","<ul><li></li><li></li><li></li></ul>
Metas Muse Spark AI answers questions based on what its learned from the social network.
Metas Muse Spark AI answers questions based on what its learned from th… [+2403 chars]",sports,facebooks new ai mode search gets its info from public posts your public facebook posts could help inform aigenerated results in metas new ai mode when you search on facebook the ai mode option will appear alongside the usual search modes like people and marketplace its one of several new ai features meta i ullilililililiul metas muse spark ai answers questions based on what its learned from the social network metas muse spark ai answers questions based on what its learned from th chars
I'm not a sports fanatic. But the Knicks' championship was more than a sports story.,The New York Knicks won its first championship in 53 years on Saturday. This non-fanatic ruminates on the takeaways for all of us.,"A Knicks fan celebrates the team's first championship in 53 years in New York City.David Dee Delgado/Getty Images
<ul><li>The Knicks won their first championship in 53 years on Saturday.</li><li>The… [+1306 chars]",sports,im not a sports fanatic but the knicks championship was more than a sports story the new york knicks won its first championship in years on saturday this nonfanatic ruminates on the takeaways for all of us a knicks fan celebrates the teams first championship in years in new york citydavid dee delgadogetty images ullithe knicks won their first championship in years on saturdaylilithe chars
"Today's NYT Connections: Sports Edition Hints and Answers for June 21, #636","Here's today's Connections: Sports Edition answer and hints for groups. These clues will help you solve The New York Times' popular puzzle game, Connections: Sports Edition, every day.","Looking for the most recent regular Connections answers? Click here for today's Connections hints, as well as our daily answers and hints for The New York Times Mini Crossword, Wordle and Strands puz… [+1959 chars]",sports,todays nyt connections sports edition hints and answers for june heres todays connections sports edition answer and hints for groups these clues will help you solve the new york times popular puzzle game connections sports edition every day looking for the most recent regular connections answers click here for todays connections hints as well as our daily answers and hints for the new york times mini crossword wordle and strands puz chars
"Today's NYT Connections: Sports Edition Hints and Answers for June 22, #637","Here's today's Connections: Sports Edition answer and hints for groups. These clues will help you solve The New York Times' popular puzzle game, Connections: Sports Edition, every day.","Looking for the most recent regular Connections answers? Click here for today's Connections hints, as well as our daily answers and hints for The New York Times Mini Crossword, Wordle and Strands puz… [+1928 chars]",sports,todays nyt connections sports edition hints and answers for june heres todays connections sports edition answer and hints for groups these clues will help you solve the new york times popular puzzle game connections sports edition every day looking for the most recent regular connections answers click here for todays connections hints as well as our daily answers and hints for the new york times mini crossword wordle and strands puz chars
"Today's NYT Connections: Sports Edition Hints and Answers for June 27, #642","Here's today's Connections: Sports Edition answer and hints for groups. These clues will help you solve The New York Times' popular puzzle game, Connections: Sports Edition, every day.","Looking for the most recent regular Connections answers? Click here for today's Connections hints, as well as our daily answers and hints for The New York Times Mini Crossword, Wordle and Strands puz… [+2044 chars]",sports,todays nyt connections sports edition hints and answers for june heres todays connections sports edition answer and hints for groups these clues will help you solve the new york times popular puzzle game connections sports edition every day looking for the most recent regular connections answers click here for todays connections hints as well as our daily answers and hints for the new york times mini crossword wordle and strands puz chars
"Today's NYT Connections: Sports Edition Hints and Answers for June 3, #618","Here's today's Connections: Sports Edition answer and hints for groups. These clues will help you solve The New York Times' popular puzzle game, Connections: Sports Edition, every day.","Looking for the most recent regular Connections answers? Click here for today's Connections hints, as well as our daily answers and hints for The New York Times Mini Crossword, Wordle and Strands puz… [+2009 chars]",sports,todays nyt connections sports edition hints and answers for june heres todays connections sports edition answer and hints for groups these clues will help you solve the new york times popular puzzle game connections sports edition every day looking for the most recent regular connections answers click here for todays connections hints as well as our daily answers and hints for the new york times mini crossword wordle and strands puz chars
"Today's NYT Connections: Sports Edition Hints and Answers for June 24, #639","Here's today's Connections: Sports Edition answer and hints for groups. These clues will help you solve The New York Times' popular puzzle game, Connections: Sports Edition, every day.","Looking for the most recent regular Connections answers? Click here for today's Connections hints, as well as our daily answers and hints for The New York Times Mini Crossword, Wordle and Strands puz… [+1850 chars]",sports,todays nyt connections sports edition hints and answers for june heres todays connections sports edition answer and hints for groups these clues will help you solve the new york times popular puzzle game connections sports edition every day looking for the most recent regular connections answers click here for todays connections hints as well as our daily answers and hints for the new york times mini crossword wordle and strands puz chars
"Today's NYT Connections: Sports Edition Hints and Answers for June 7, #622","Here's today's Connections: Sports Edition answer and hints for groups. These clues will help you solve The New York Times' popular puzzle game, Connections: Sports Edition, every day.","Looking for the most recent regular Connections answers? Click here for today's Connections hints, as well as our daily answers and hints for The New York Times Mini Crossword, Wordle and Strands puz… [+1941 chars]",sports,todays nyt connections sports edition hints and answers for june heres todays connections sports edition answer and hints for groups these clues will help you solve the new york times popular puzzle game connections sports edition every day looking for the most recent regular connections answers click here for todays connections hints as well as our daily answers and hints for the new york times mini crossword wordle and strands puz chars
"Today's NYT Connections: Sports Edition Hints and Answers for June 4, #619","Here's today's Connections: Sports Edition answer and hints for groups. These clues will help you solve The New York Times' popular puzzle game, Connections: Sports Edition, every day.","Looking for the most recent regular Connections answers? Click here for today's Connections hints, as well as our daily answers and hints for The New York Times Mini Crossword, Wordle and Strands puz… [+2014 chars]",sports,todays nyt connections sports edition hints and answers for june heres todays connections sports edition answer and hints for groups these clues will help you solve the new york times popular puzzle game connections sports edition every day looking for the most recent regular connections answers click here for todays connections hints as well as our daily answers and hints for the new york times mini crossword wordle and strands puz chars
"Today's NYT Connections: Sports Edition Hints and Answers for June 29, #644","Here's today's Connections: Sports Edition answer and hints for groups. These clues will help you solve The New York Times' popular puzzle game, Connections: Sports Edition, every day.","Looking for the most recent regular Connections answers? Click here for today's Connections hints, as well as our daily answers and hints for The New York Times Mini Crossword, Wordle and Strands puz… [+1861 chars]",sports,todays nyt connections sports edition hints and answers for june heres todays connections sports edition answer and hints for groups these clues will help you solve the new york times popular puzzle game connections sports edition every day looking for the most recent regular connections answers click here for todays connections hints as well as our daily answers and hints for the new york times mini crossword wordle and strands puz chars
The Fitbit Air takes a smarter approach to the AI health dumpster fire,"Google Health Coach seems to think I'm on the verge of physical collapse. My sleep is not where it needs to be, hence my unimpressive readiness score. My heart rate variability, a measure of how recovered I am, is below baseline. I'm spending too much time in…","<ul><li></li><li></li><li></li></ul>
Google Health remains a work in progress, but it could be so much worse.
If you buy something from a Verge link, Vox Media may earn a commission. See our ethics… [+14534 chars]",health,the fitbit air takes a smarter approach to the ai health dumpster fire google health coach seems to think im on the verge of physical collapse my sleep is not where it needs to be hence my unimpressive readiness score my heart rate variability a measure of how recovered i am is below baseline im spending too much time in ullilililililiul google health remains a work in progress but it could be so much worse if you buy something from a verge link vox media may earn a commission see our ethics chars
"New York’s Latest Tourist? A Rare, Potentially More Severe Form of Lyme Disease","This week, health officials reported the first known case of Borrelia mayonii in New York.","A rare form of Lyme disease is making inroads into the United States.
On Thursday, researchers and local health officials in New York detailed a case of Lyme caused by the bacterium Borrelia mayonii… [+3976 chars]",health,new yorks latest tourist a rare potentially more severe form of lyme disease this week health officials reported the first known case of borrelia mayonii in new york a rare form of lyme disease is making inroads into the united states on thursday researchers and local health officials in new york detailed a case of lyme caused by the bacterium borrelia mayonii chars
"Even One Drink a Day Could Raise Your Cancer Risk, Study Warns","For some health conditions like cancer, there's no safe level of alcohol consumption, a large new review finds.","A drink a day won’t keep the cancer away. New research shows even light amounts of alcohol consumption might raise people’s risk of several cancers.
Scientists at the University of Washington in Sea… [+3256 chars]",health,even one drink a day could raise your cancer risk study warns for some health conditions like cancer theres no safe level of alcohol consumption a large new review finds a drink a day wont keep the cancer away new research shows even light amounts of alcohol consumption might raise peoples risk of several cancers scientists at the university of washington in sea chars
Fire at Massive Medical Warehouse in California Pumps Toxic Smoke Into the Air,Health officials warn the smoke could be hazardous to multiple communities in the Central Valley and San Joaquin Valley.,"A medical warehouse in Tracy, California, was burning out of control on Thursday, filling the air with black smoke contaminated by medical supplies and building materials.
The 1 million-square-foot … [+4264 chars]",health,fire at massive medical warehouse in california pumps toxic smoke into the air health officials warn the smoke could be hazardous to multiple communities in the central valley and san joaquin valley a medical warehouse in tracy california was burning out of control on thursday filling the air with black smoke contaminated by medical supplies and building materials the millionsquarefoot chars
"Americans Are in the Dark About the Dangers of Hot Dogs, Survey Finds","Only 11% could name a specific health risk linked to hot dogs and other processed meats, such as cancer.","With the Fourth of July coming up, there’s almost certain to be a hidden and dangerous threat lurking in your refrigerator or freezer. I’m talking, of course, about hot dogs.
A new poll this week, c… [+3563 chars]",health,americans are in the dark about the dangers of hot dogs survey finds only could name a specific health risk linked to hot dogs and other processed meats such as cancer with the fourth of july coming up theres almost certain to be a hidden and dangerous threat lurking in your refrigerator or freezer im talking of course about hot dogs a new poll this week c chars
The Sperm-Maxxing Bros Are Actually Onto Something,"Wellness influencers have stumbled onto a huge issue when it comes male fertility, though not every solution they're pitching is good advice.","Supplements are like a religion for Pachi Paris, a 29-year-old from Miami who works in finance. So when he and his wife started trying to conceive last year, it felt only natural that he started taki… [+3472 chars]",health,the spermmaxxing bros are actually onto something wellness influencers have stumbled onto a huge issue when it comes male fertility though not every solution theyre pitching is good advice supplements are like a religion for pachi paris a yearold from miami who works in finance so when he and his wife started trying to conceive last year it felt only natural that he started taki chars
'Lazy but convenient' - a quarter of young adults in Wales have two or more takeaways a week,Public Health Wales said it must become easier for people to make healthier eating choices.,"Dr Catherine Sharp, from PHW, said it must become easier for young people to make healthier choices, pointing out how ""easy"" and ""convenient"" it is to order food using a phone.",health,lazy but convenient a quarter of young adults in wales have two or more takeaways a week public health wales said it must become easier for people to make healthier eating choices dr catherine sharp from phw said it must become easier for young people to make healthier choices pointing out how easy and convenient it is to order food using a phone
Is watching England in the World Cup bad for your health?,Watching football is an emotional rollercoaster - but is it good or bad for your health?,"""I want to see a stress response, excitement, emotional anxiety, fear, shouting, forgetting to breathe, perhaps breathing too much, all of the above.""",health,is watching england in the world cup bad for your health watching football is an emotional rollercoaster but is it good or bad for your health i want to see a stress response excitement emotional anxiety fear shouting forgetting to breathe perhaps breathing too much all of the above
Asus’ VivoWatch 6 Plus Can Send Health Data to Your Doctor,The Asus AI Agent now works in healthcare.,"The new Asus VivoWatch 6 Plus, announced at Computex 2026, is more than just a smartwatch that sends you notifications or tracks your workouts. Its part of the Asus AI-powered health care ecosystem. … [+2423 chars]",health,asus vivowatch plus can send health data to your doctor the asus ai agent now works in healthcare the new asus vivowatch plus announced at computex is more than just a smartwatch that sends you notifications or tracks your workouts its part of the asus aipowered health care ecosystem chars
Six-year-old Ebola patient taken from DR Congo hospital found and 'doing well',Health facilities have come under attack during the current outbreak as a result of misinformation and fear.,"A six-year-old Ebola patient, who Congolese authorities were searching for after armed men stormed the hospital where she was being treated, has been found and is ""doing well"", a local health officia… [+18 chars]",health,sixyearold ebola patient taken from dr congo hospital found and doing well health facilities have come under attack during the current outbreak as a result of misinformation and fear a sixyearold ebola patient who congolese authorities were searching for after armed men stormed the hospital where she was being treated has been found and is doing well a local health officia chars
The Weather Channel app now predicts bad allergy days,"The Weather Company announced an ""enhanced allergy experience"" now available through its The Weather Channel app designed to help allergy sufferers better understand when their symptoms might flare up, and what's causing them. While the app already provides s…","<ul><li></li><li></li><li></li></ul>
A new update now factors in weather conditions like wind to help you understand why youre suddenly sneezing.
A new update now factors in weather conditions like… [+3003 chars]",health,the weather channel app now predicts bad allergy days the weather company announced an enhanced allergy experience now available through its the weather channel app designed to help allergy sufferers better understand when their symptoms might flare up and whats causing them while the app already provides s ullilililililiul a new update now factors in weather conditions like wind to help you understand why youre suddenly sneezing a new update now factors in weather conditions like chars
"Apple announces watchOS 27, now with Siri AI","Apple just announced watchOS 27, the next version of its Apple Watch operating system, introducing support for Siri AI, a redesigned ""dynamic"" app grid, and improvements to health and fitness tracking. The watchOS 27 update will be available ""this fall,"" acco…","<ul><li></li><li></li><li></li></ul>
The upcoming update will be limited to Apples more recent Watch models.
The upcoming update will be limited to Apples more recent Watch models.
by
Jess Weathe… [+4841 chars]",health,apple announces watchos now with siri ai apple just announced watchos the next version of its apple watch operating system introducing support for siri ai a redesigned dynamic app grid and improvements to health and fitness tracking the watchos update will be available this fall acco ullilililililiul the upcoming update will be limited to apples more recent watch models the upcoming update will be limited to apples more recent watch models by jess weathe chars
"The Apple Watch Series 11 is $120 off for Prime Day, its all-time low price","We’ve seen a lot of great Prime Day deals on wearables this year, from the Fitbit Charge 6 to the latest Apple Watch SE. But if you’re looking for advanced health features, the Apple Watch Series 11 is the one to check out, and it’s now down to its best price…","<ul><li></li><li></li><li></li></ul>
Its our favorite Apple Watch for health tracking, offering advanced features like EKG support.
Its our favorite Apple Watch for health tracking, offering advanc… [+2900 chars]",health,the apple watch series is off for prime day its alltime low price weve seen a lot of great prime day deals on wearables this year from the fitbit charge to the latest apple watch se but if youre looking for advanced health features the apple watch series is the one to check out and its now down to its best price ullilililililiul its our favorite apple watch for health tracking offering advanced features like ekg support its our favorite apple watch for health tracking offering advanc chars
Amber Extreme Heat warning issued by Met Office as 35C heatwave approaches,Temperatures are expected to peak in the mid-30s Celsius on Monday and Tuesday with impacts on health and a risk of disruption to travel.,"The Met Office has issued an amber Extreme Heat warning for parts of southern and eastern England and south Wales.
The warning is valid for Monday and Tuesday and warns of temperatures peaking at 35… [+774 chars]",health,amber extreme heat warning issued by met office as c heatwave approaches temperatures are expected to peak in the mids celsius on monday and tuesday with impacts on health and a risk of disruption to travel the met office has issued an amber extreme heat warning for parts of southern and eastern england and south wales the warning is valid for monday and tuesday and warns of temperatures peaking at chars
The Federal Agency Fighting Bed Bugs Keeps Getting Infested But its Workers Aren’t Allowed to Telecommute,"Trump's USDA says employees of the bed bug-infested Animal and Plant Health Inspection Service are expected to show up to their noxious, itchy office or spend vacation days to work from home.","If youve thus far been fortunate enough to avoid the soul-crushing experience of a bed bug infestation, you really dont know how lucky you are. Theres no way to truly understand how their invasion, r… [+3110 chars]",health,the federal agency fighting bed bugs keeps getting infested but its workers arent allowed to telecommute trumps usda says employees of the bed buginfested animal and plant health inspection service are expected to show up to their noxious itchy office or spend vacation days to work from home if youve thus far been fortunate enough to avoid the soulcrushing experience of a bed bug infestation you really dont know how lucky you are theres no way to truly understand how their invasion r chars
"Maddy Cusack kept mental health secret over fears of stigma, inquest hears","The former Sheffield United player had feared being ridiculed and stigmatised, her inquest hears.","Former Sheffield United player Maddy Cusack was concerned she would be stigmatised and ridiculed over her mental health, an inquest has heard.
The 27-year-old was found dead at her home in Horsley, … [+1140 chars]",health,maddy cusack kept mental health secret over fears of stigma inquest hears the former sheffield united player had feared being ridiculed and stigmatised her inquest hears former sheffield united player maddy cusack was concerned she would be stigmatised and ridiculed over her mental health an inquest has heard the yearold was found dead at her home in horsley chars
Cooler Saturday gives brief relief before heat returns,"After a slightly cooler Saturday, temperatures will rise again, possibly touching 35C by Tuesday with a Met Office amber extreme heat warning set to come into force.","There will be tropical nights in some locations where overnight temperatures are expected to remain above 20C (68F).
This combination of hot days and very warm nights is likely to bring a range of i… [+590 chars]",health,cooler saturday gives brief relief before heat returns after a slightly cooler saturday temperatures will rise again possibly touching c by tuesday with a met office amber extreme heat warning set to come into force there will be tropical nights in some locations where overnight temperatures are expected to remain above c f this combination of hot days and very warm nights is likely to bring a range of i chars
The war against ‘woke’ could end US science as we know it,"A sneaky rule change has the potential to blow up scientific research in the United States. But there's still time to fight it. On May 29th, the Office of Management and Budget (OMB) issued a 412-page proposal to revise federal financial assistance. The langu…","<ul><li></li><li></li><li></li></ul>
The war against woke could end US science as we know it
Everyone will be affected, not just scientists. Every community in the country.
by
Bethany BrookshireC… [+18188 chars]",science,the war against woke could end us science as we know it a sneaky rule change has the potential to blow up scientific research in the united states but theres still time to fight it on may th the office of management and budget omb issued a page proposal to revise federal financial assistance the langu ullilililililiul the war against woke could end us science as we know it everyone will be affected not just scientists every community in the country by bethany brookshirec chars
