title,description,content,category,text
All the Ways Europe Is Ditching American Technology,"A WIRED timeline shows how dozens of governments, companies, and other organizations across Europe are moving, or planning to shift, away from US Big Tech.","Europe is done with American Big Tech. Well, sort of. Since the start of President Donald Trumps chaotic second administration last year, concerned governments and companies across the continent have… [+2955 chars]",technology,all the ways europe is ditching american technology a wired timeline shows how dozens of governments companies and other organizations across europe are moving or planning to shift away from us big tech europe is done with american big tech well sort of since the start of president donald trumps chaotic second administration last year concerned governments and companies across the continent have chars
IBM Crosses One of Computing’s Biggest Barriers With World’s First Sub-1 Nanometer Chip,The new chip technology packs nearly 100 billion transistors into a fingernail-sized chip.,"In a major breakthrough, IBM revealed the world’s first semiconductor chip technology built on a sub-1 nanometer chipmaking process. For comparison, the process uses transistor features smaller than … [+3403 chars]",technology,ibm crosses one of computings biggest barriers with worlds first sub nanometer chip the new chip technology packs nearly billion transistors into a fingernailsized chip in a major breakthrough ibm revealed the worlds first semiconductor chip technology built on a sub nanometer chipmaking process for comparison the process uses transistor features smaller than chars
Meta Is Testing Police Surveillance Tech for Its Smart Glasses,A report suggests ties between Meta's facial recognition technology and a company that sells surveillance tools to military and police.,"Meta is finding inspiration for its smart glasses in some pretty concerning corners. According to Wired, the company is testing software built by a firm that sells surveillance tech to the U.S. gover… [+2194 chars]",technology,meta is testing police surveillance tech for its smart glasses a report suggests ties between metas facial recognition technology and a company that sells surveillance tools to military and police meta is finding inspiration for its smart glasses in some pretty concerning corners according to wired the company is testing software built by a firm that sells surveillance tech to the us gover chars
Trump Admin Declares Total Victory Over Algae Thanks to ‘Advanced Nanobubbler Technology’,"""The Reflecting Pool water is crystal clear,"" the Department of the Interior insists.","The U.S. may have lost its war against Iran, but there is another war that President Donald Trump still might be able to win. And that’s his war on algae in Washington, D.C.’s Lincoln Memorial Reflec… [+4541 chars]",technology,trump admin declares total victory over algae thanks to advanced nanobubbler technology the reflecting pool water is crystal clear the department of the interior insists the us may have lost its war against iran but there is another war that president donald trump still might be able to win and thats his war on algae in washington dcs lincoln memorial reflec chars
Elon Musk is steamrolling Wall Street to become a trillionaire,"Today on Decoder, I’m talking to Ryan Mac, a technology reporter at The New York Times and coauthor of the excellent book Character Limit: How Elon Musk Destroyed Twitter, which came out in 2024. I can’t recommend it enough.  I wanted to have Ryan on the show…","<ul><li></li><li></li><li></li></ul>
The New York Times Ryan Mac on how the SpaceX IPO is shaping up to be the greatest Musk gambit yet.
by
Nilay PatelClose
Posts from this author will be added t… [+42386 chars]",technology,elon musk is steamrolling wall street to become a trillionaire today on decoder im talking to ryan mac a technology reporter at the new york times and coauthor of the excellent book character limit how elon musk destroyed twitter which came out in i cant recommend it enough i wanted to have ryan on the show ullilililililiul the new york times ryan mac on how the spacex ipo is shaping up to be the greatest musk gambit yet by nilay patelclose posts from this author will be added t chars
Schlage’s UWB-enabled smart lock launches this month,"It's been more than a year since Schlage announced its first smart lock to support ultra wideband technology (UWB), but now it's finally almost available to purchase. Starting June 29th, the Schlage Sense Pro deadbolt lock will be available for $399 in the US…","<ul><li></li><li></li><li></li></ul>
The Schlage Sense Pro will work with Apples Home Key hands-free unlocking and is its first to support Matter and Thread.
The Schlage Sense Pro will work with Ap… [+3213 chars]",technology,schlages uwbenabled smart lock launches this month its been more than a year since schlage announced its first smart lock to support ultra wideband technology uwb but now its finally almost available to purchase starting june th the schlage sense pro deadbolt lock will be available for in the us ullilililililiul the schlage sense pro will work with apples home key handsfree unlocking and is its first to support matter and thread the schlage sense pro will work with ap chars
AI leaders call for tougher protections against AI-aided bioweapons,"Some of the AI industry's biggest rivals have put their many, many grievances aside for a common cause: making it harder for people to use their technology to develop biological weapons. In an open letter to US lawmakers, tech leaders are pressing Congress to…","<ul><li></li><li></li><li></li></ul>
AI industry rivals rarely agree, but theyre all concerned their technology could be used to develop biological weapons.
AI industry rivals rarely agree, but the… [+3704 chars]",technology,ai leaders call for tougher protections against aiaided bioweapons some of the ai industrys biggest rivals have put their many many grievances aside for a common cause making it harder for people to use their technology to develop biological weapons in an open letter to us lawmakers tech leaders are pressing congress to ullilililililiul ai industry rivals rarely agree but theyre all concerned their technology could be used to develop biological weapons ai industry rivals rarely agree but the chars
Meta Tapped a Pentagon Supplier to Prototype Face Recognition for Its Glasses,"Rank One, whose board includes a former CIA deputy director and a former FBI science chief, supplied face recognition to Meta for internal development of its smart glasses app.","Meta is testingface-recognition software built by a company that sells surveillance tools to police departments and the United States military, as it explores bringing the technology to its smart gla… [+3367 chars]",technology,meta tapped a pentagon supplier to prototype face recognition for its glasses rank one whose board includes a former cia deputy director and a former fbi science chief supplied face recognition to meta for internal development of its smart glasses app meta is testingfacerecognition software built by a company that sells surveillance tools to police departments and the united states military as it explores bringing the technology to its smart gla chars
The Secret Revolution in Battery Technology: 3-D Printing,"""There's a revolution in battery technology hiding in plain sight,"" reports The Wall Street Journal. ""The 3-D printing of batteries has the potential to put energy storage inside any device. 

""This will enable lightweight and long-lasting consumer gadgets, l…","""There's a revolution in battery technology hiding in plain sight,"" reports The Wall Street Journal. ""The 3-D printing of batteries has the potential to put energy storage inside any device.""This wil… [+2151 chars]",technology,the secret revolution in battery technology d printing theres a revolution in battery technology hiding in plain sight reports the wall street journal the d printing of batteries has the potential to put energy storage inside any device this will enable lightweight and longlasting consumer gadgets l theres a revolution in battery technology hiding in plain sight reports the wall street journal the d printing of batteries has the potential to put energy storage inside any devicethis wil chars
The White House Is Making Up Its Rules for AI in Real Time,Anthropic still can’t distribute Claude Mythos or Fable 5 after running afoul of the Trump administration. But no one can say exactly what the company did wrong.,"Its been nearly a week since the Trump administration sent an export control directive to Anthropic, forcing one of the worlds leading AI labs to pull its most advanced models offline. After days of … [+3695 chars]",technology,the white house is making up its rules for ai in real time anthropic still cant distribute claude mythos or fable after running afoul of the trump administration but no one can say exactly what the company did wrong its been nearly a week since the trump administration sent an export control directive to anthropic forcing one of the worlds leading ai labs to pull its most advanced models offline after days of chars
"This World Cup, Bigger Might Not Really Be Better","The biggest World Cup ever is pushing fans, players, and host cities to their limits—and experts say this is only the beginning.","An average visitor is expected to spend around $5,400 in the USfar above the $720-$2,500 visitors to Qatar spent in 2022.
Transport at this years tournament is fundamentally different from that of t… [+2979 chars]",technology,this world cup bigger might not really be better the biggest world cup ever is pushing fans players and host cities to their limitsand experts say this is only the beginning an average visitor is expected to spend around in the usfar above the visitors to qatar spent in transport at this years tournament is fundamentally different from that of t chars
The Korean Telecom Giant at the Center of Anthropic’s Mythos Controversy,"Days before Anthropic took its most advanced AI models offline, the White House ordered the company to revoke SK Telecom’s access to Claude Mythos over claims of alleged ties to China.",The Trump administrations move to impose export controls on Anthropics most powerful AI technology followed a spat over the company granting South Korean telecom giant SK Telecom access to its Claude… [+3694 chars],technology,the korean telecom giant at the center of anthropics mythos controversy days before anthropic took its most advanced ai models offline the white house ordered the company to revoke sk telecoms access to claude mythos over claims of alleged ties to china the trump administrations move to impose export controls on anthropics most powerful ai technology followed a spat over the company granting south korean telecom giant sk telecom access to its claude chars
Xbox exploring ‘radically different’ console business models,The RAMageddon crisis has got Microsoft rethinking its Xbox console hardware business. Xbox CEO Asha Sharma and Xbox strategy chief Matthew Ball have both revealed this week that Microsoft is re-evaluating plans for its next-generation Project Helix console a…,"<ul><li></li><li></li><li></li></ul>
Microsoft is re-evaluating its plans for Project Helix and considering new ways to lower Xbox console costs.
Microsoft is re-evaluating its plans for Project He… [+6463 chars]",business,xbox exploring radically different console business models the ramageddon crisis has got microsoft rethinking its xbox console hardware business xbox ceo asha sharma and xbox strategy chief matthew ball have both revealed this week that microsoft is reevaluating plans for its nextgeneration project helix console a ullilililililiul microsoft is reevaluating its plans for project helix and considering new ways to lower xbox console costs microsoft is reevaluating its plans for project he chars
What to Do in Houston If You're Here for Business (2026),"Discover the best hotels, restaurants, bars, coffee shops, and coworking space in our business traveler’s guide to Houston.","Houston, TX, USA - September 10, 2018: The Marriott Marquis is a Four Diamond hotel located in downtown Houston and features a Texas shaped pool, five restaurants and beautiful views from all angles.… [+4882 chars]",business,what to do in houston if youre here for business discover the best hotels restaurants bars coffee shops and coworking space in our business travelers guide to houston houston tx usa september the marriott marquis is a four diamond hotel located in downtown houston and features a texas shaped pool five restaurants and beautiful views from all angles chars
Someone Is Suing the U.S. For Making Them Go Without Anthropic’s Fable 5 Model,"Legion, a startup, says being denied access to Fable is damaging its business.","Anthropic’s Claude Fable 5 AI model was released to the public on June 9 and taken down on June 12. By my math, it was available for a little over three days. Anthropic took down Fable 5 voluntarily … [+2648 chars]",business,someone is suing the us for making them go without anthropics fable model legion a startup says being denied access to fable is damaging its business anthropics claude fable ai model was released to the public on june and taken down on june by my math it was available for a little over three days anthropic took down fable voluntarily chars
"Facing a seismic by-election, the people of Makerfield tell us what matters to them","In conversations with residents, business owners and campaigners in Makerfield, the BBC found a mixed mood.","In some ways, the constituency is divided between the better-off neighbourhoods of Ashton, Orrell, and Winstanley in the west, and the more deprived areas of Platt Bridge, Abram and Hindley in the ea… [+2 chars]",business,facing a seismic byelection the people of makerfield tell us what matters to them in conversations with residents business owners and campaigners in makerfield the bbc found a mixed mood in some ways the constituency is divided between the betteroff neighbourhoods of ashton orrell and winstanley in the west and the more deprived areas of platt bridge abram and hindley in the ea chars
Andrew Yang Is Living the Presidential Life (Trying to Build a Mobile Phone Business),The former presidential candidate’s Noble Mobile just acquired Helium Mobile.,"So, what has Andrew Yang been up to since his unsuccessful runs for U.S. president and mayor of New York City? Like our current president, he is now in the mobile phone business.
Yang launched a bud… [+2718 chars]",business,andrew yang is living the presidential life trying to build a mobile phone business the former presidential candidates noble mobile just acquired helium mobile so what has andrew yang been up to since his unsuccessful runs for us president and mayor of new york city like our current president he is now in the mobile phone business yang launched a bud chars
Karren Brady stayed at West Ham despite knowing of Sullivan women's team ban,"Brady's lawyers said she had ""no knowledge"" of the allegations made against long-time business partner David Sullivan.","Baroness Brady, 57, who is best known for her role on BBC One's The Apprentice, has worked for Sullivan for the best part of four decades, including 16 years as vice-chair at West Ham.",business,karren brady stayed at west ham despite knowing of sullivan womens team ban bradys lawyers said she had no knowledge of the allegations made against longtime business partner david sullivan baroness brady who is best known for her role on bbc ones the apprentice has worked for sullivan for the best part of four decades including years as vicechair at west ham
Smart lock maker Level has been gutted and its founders are out,"Assa Abloy has laid off the majority of staff at Level Home, the smart lock company known for building smart tech into traditional-looking deadbolts, and is folding the business into Kwikset, according to a source familiar with the decision. The Verge obtaine…","<ul><li></li><li></li><li></li></ul>
A source tells The Verge that Assa Abloy has laid off the majority of Level Homes staff and is folding it into Kwikset. Assa Abloy says it will continue to devel… [+4077 chars]",business,smart lock maker level has been gutted and its founders are out assa abloy has laid off the majority of staff at level home the smart lock company known for building smart tech into traditionallooking deadbolts and is folding the business into kwikset according to a source familiar with the decision the verge obtaine ullilililililiul a source tells the verge that assa abloy has laid off the majority of level homes staff and is folding it into kwikset assa abloy says it will continue to devel chars
Bose thinks it can be a media company for some reason,"The history books are littered with the corpses of corporate record labels started by companies that had no business being in the music industry. Bose thinks it can be the exception to the rule. It thinks it can be Red Bull. And, while Bose has more of a righ…","<ul><li></li><li></li><li></li></ul>
Bose Studios is a record label, a movie studio, a podcast network, and a failure waiting to happen.
Bose Studios is a record label, a movie studio, a podcast ne… [+4123 chars]",business,bose thinks it can be a media company for some reason the history books are littered with the corpses of corporate record labels started by companies that had no business being in the music industry bose thinks it can be the exception to the rule it thinks it can be red bull and while bose has more of a righ ullilililililiul bose studios is a record label a movie studio a podcast network and a failure waiting to happen bose studios is a record label a movie studio a podcast ne chars
Let him cook: How Weber Blackstone CEO Roger Dahle went from upstart to the biggest name in grilling,It’s time for our annual Fourth of July grill episode here at Decoder. This is when we invite the CEOs of outdoor cooking companies onto the show to explain just how their businesses kind of look like every other business. And this is a very special edition. …,"<ul><li></li><li></li><li></li></ul>
After taking over Weber, Blackstone founder Roger Dahles new job is integrating his griddle empire with what used to be his biggest competitor.
If you buy somet… [+69198 chars]",business,let him cook how weber blackstone ceo roger dahle went from upstart to the biggest name in grilling its time for our annual fourth of july grill episode here at decoder this is when we invite the ceos of outdoor cooking companies onto the show to explain just how their businesses kind of look like every other business and this is a very special edition ullilililililiul after taking over weber blackstone founder roger dahles new job is integrating his griddle empire with what used to be his biggest competitor if you buy somet chars
VSCO launches Studio Pro mobile photo editing app and plans $500 per year subscription,"VSCO is taking on Adobe with a new Studio Pro editing app rolling out today on iOS and coming to macOS later this year, as Bloomberg reports. At launch, the app offers tools for batch editing, style matching from a reference image, and sharing images through …","<ul><li></li><li></li><li></li></ul>
The VSCO One subscription bundle is aimed at handling a professional photographers entire business, from editing to delivery.
The VSCO One subscription bundle i… [+2278 chars]",business,vsco launches studio pro mobile photo editing app and plans per year subscription vsco is taking on adobe with a new studio pro editing app rolling out today on ios and coming to macos later this year as bloomberg reports at launch the app offers tools for batch editing style matching from a reference image and sharing images through ullilililililiul the vsco one subscription bundle is aimed at handling a professional photographers entire business from editing to delivery the vsco one subscription bundle i chars
Is Apple TV the new HBO?,"This is Lowpass by Janko Roettgers, a newsletter on the ever-evolving intersection of tech and entertainment, syndicated just for The Verge subscribers once a week. Severance. Pachinko. Silo. Ted Lasso. Over the past couple of years, a number of Apple TV show…","<ul><li></li><li></li><li></li></ul>
Unlike competitors like Netflix, Apple TV emphasizes tentpole titles over large catalogs.
Unlike competitors like Netflix, Apple TV emphasizes tentpole titles o… [+6523 chars]",business,is apple tv the new hbo this is lowpass by janko roettgers a newsletter on the everevolving intersection of tech and entertainment syndicated just for the verge subscribers once a week severance pachinko silo ted lasso over the past couple of years a number of apple tv show ullilililililiul unlike competitors like netflix apple tv emphasizes tentpole titles over large catalogs unlike competitors like netflix apple tv emphasizes tentpole titles o chars
"What Would Jesus Do? Invest in Palantir, Apparently","But SpaceX would not be considered ""biblically responsible investing.""","Investors should ask a lot of questions before deciding to bet any portion of their future on a company. For the folks at Inspire Investing, one of those questions is apparently, “What would Christ i… [+2910 chars]",business,what would jesus do invest in palantir apparently but spacex would not be considered biblically responsible investing investors should ask a lot of questions before deciding to bet any portion of their future on a company for the folks at inspire investing one of those questions is apparently what would christ i chars
"No more lightbulbs, much more sports: Five predictions for Roku’s future","This is Lowpass by Janko Roettgers, a newsletter on the ever-evolving intersection of tech and entertainment, syndicated just for The Verge subscribers once a week. When Fox announced its acquisition of Roku earlier this week, executives of both companies wer…","<ul><li></li><li></li><li></li></ul>
How getting acquired by Fox will change things for the streaming device maker, from its IoT business to its international expansion.
How getting acquired by Fox… [+7892 chars]",sports,no more lightbulbs much more sports five predictions for rokus future this is lowpass by janko roettgers a newsletter on the everevolving intersection of tech and entertainment syndicated just for the verge subscribers once a week when fox announced its acquisition of roku earlier this week executives of both companies wer ullilililililiul how getting acquired by fox will change things for the streaming device maker from its iot business to its international expansion how getting acquired by fox chars
US Supreme Court upholds bans on transgender women in female school and college sports,It rules that states can ban transgender athletes from competing in women's and girls' sports.,"The US Supreme Court has ruled that states can ban transgender women from competing in female school and college sports.
The court considered cases from students in two different states who had chal… [+1596 chars]",sports,us supreme court upholds bans on transgender women in female school and college sports it rules that states can ban transgender athletes from competing in womens and girls sports the us supreme court has ruled that states can ban transgender women from competing in female school and college sports the court considered cases from students in two different states who had chal chars
"Taller, faster, older: How top footballers' bodies have changed over 50 years","More intense match play and advances in medicine and sports science have transformed the physiology of elite players, experts say.","Studies suggest that in the 1970s, players walked, jogged or ran an average of 8.7km per match - and this rose to a peak of 11.4km in the 1990s, but has since dropped. Players in the 2022 World Cup c… [+111 chars]",sports,taller faster older how top footballers bodies have changed over years more intense match play and advances in medicine and sports science have transformed the physiology of elite players experts say studies suggest that in the s players walked jogged or ran an average of km per match and this rose to a peak of km in the s but has since dropped players in the world cup c chars
Google launches Wear OS 7 with Live Updates and a battery life boost,"Google's Wear OS 7 update is starting to roll out today for the Pixel Watch 2, 3, and 4 , adding a new Live Updates feature that tracks live events from your Android smart watch. Live Updates will now sync with Wear OS devices, so updates like sports scores o…","<ul><li></li><li></li><li></li></ul>
Pixel watches will also get Gemini Intelligence features later this year, like AI-generated widgets.
Pixel watches will also get Gemini Intelligence features la… [+3394 chars]",sports,google launches wear os with live updates and a battery life boost googles wear os update is starting to roll out today for the pixel watch and adding a new live updates feature that tracks live events from your android smart watch live updates will now sync with wear os devices so updates like sports scores o ullilililililiul pixel watches will also get gemini intelligence features later this year like aigenerated widgets pixel watches will also get gemini intelligence features la chars
